{
  "nom": "mailpit",
  "image": "axllent/mailpit",
  "version": "v1.20.4",
  "empreinte": "sha256:ff82a613c735f4e8a3ddfdf7ee4e18cb934c721e72a340ecbbb7ec0ca7fbd057",
  "licence": "MIT",
  "livree": false,
  "lieu": "local",
  "source": "https://github.com/axllent/mailpit",
  "verifie_le": "2026-10-24"
}
