{
  "nom": "sftp-essai",
  "image": "atmoz/sftp",
  "version": "alpine",
  "empreinte": "sha256:43dd1c023cf1bae487127d4b54660b0aee6e94c188a6599be36fb89ba115f961",
  "licence": "MIT",
  "livree": false,
  "lieu": "local",
  "source": "https://github.com/atmoz/sftp",
  "verifie_le": "2026-10-26",
  "note": "Cible SFTP d'essai qui imite la Storage Box ; jamais livrée, jamais en production."
}
