{
  "nom": "valkey",
  "image": "valkey/valkey",
  "version": "8.1.10",
  "empreinte": "sha256:640c5e62cea04b6d6f2084232651d0cc70362d31f4f805e7be94dbed6855e8f2",
  "licence": "BSD-3-Clause",
  "livree": false,
  "lieu": "local",
  "source": "https://github.com/valkey-io/valkey",
  "verifie_le": "2026-10-25"
}
